{
  "schema_version": 1,
  "id": "up_lucky",
  "name": "MonteCarloBot",
  "runtime": "python",
  "entrypoint": "adapter:Bot",
  "capabilities": {
    "variant": "nlhe",
    "min_players": 2,
    "max_players": 9
  },
  "default_params": {
    "samples": 80
  },
  "runtime_network": false,
  "competition_eligible": false,
  "provenance": {
    "kind": "upstream-policy-extract",
    "original_number": 6,
    "repository": "luckyone18/Poker",
    "policy": "MonteCarloBot",
    "note": "Actual Monte Carlo policy. Original multiway ties are valued at one half, preserved."
  }
}
